{
  "id": "sector-externo",
  "nombre": "Sector externo",
  "voz_institucional": "Boletín de Comercio Exterior",
  "variables_controladas": [
    "tipo-cambio",
    "flujos-capital",
    "exportaciones-netas"
  ],
  "variables_recibidas": [
    "tasa-interes-dom-vs-externa",
    "terminos-intercambio"
  ],
  "activo": false
}
